participant.id_in_session,participant.code,participant.label,participant._is_bot,participant._index_in_pages,participant._max_page_index,participant._current_app_name,participant._current_page_name,participant.time_started_utc,participant.visited,participant.mturk_worker_id,participant.mturk_assignment_id,participant.payoff,player.id_in_group,player.role,player.payoff,player.own_strategy,player.other_players_strategy,player.pilot_difficulty,player.pilot_explanation,player.pilot_interface,player.pilot_time,player.research_question,player.comments,player.dummy_player_axiom,player.symmetry_axiom,player.efficiency_axiom,player.linearity_additivity_axiom,player.linearity_HD1_axiom,player.stability_axiom,group.id_in_subsession,subsession.round_number,session.code,session.label,session.mturk_HITId,session.mturk_HITGroupId,session.comment,session.is_demo
22,1r7pqbse,BLU_10,0,45,45,survey,Completion,2024-05-16 11:41:36.519575,1,,,125.0,22,,0.0,"Since I am bad at the slide things, I am always B1 or B2, so I will propose 34 33 33 first, but if A is greedy, the most I can accept is 50 25 25. Other than that, everyone get nothing. ","Some A are too greedy, and they just want to push my boundary. Most B I met have the same strategy as me.",Medium difficulty,Well,Very well,Just right,No idea.,,Strongly Agree,Strongly Agree,Strongly Agree,Strongly Agree,Disagree,Strongly Agree,1,1,m7xcm95f,,,,,0
23,08vr2i2p,BLU_12,0,45,45,survey,Completion,2024-05-16 11:41:36.527218,1,,,167.0,23,,0.0,even for everyone as much as possible. but give a little advantage to A,"I saw all other players had same strategy with me except one A in round 3. But, I felt like A has a strong power at that moment.",Easy,Well,Very well,Too much,Monarch vs. Democracy,,No opinion,No opinion,Strongly Agree,Agree,Disagree,No opinion,1,1,m7xcm95f,,,,,0
24,j5qn3qbk,BLU_13,0,45,45,survey,Completion,2024-05-16 11:41:36.535876,1,,,169.0,24,,0.0,If youre not player A you should try to get something fair for everyone and   if you are A : try to get more points as others depend on you,some aimed for a fair solution while there were some who wanted unfair solutions,Easy,Well,Well,Too much,,,Neutral,Strongly Agree,Agree,Neutral,Disagree,Agree,1,1,m7xcm95f,,,,,0
25,hjneoci2,BLU_25,0,45,45,survey,Completion,2024-05-16 11:41:36.545030,1,,,169.0,25,,0.0,"not exactly, mostly it was 343333",nothing as such,Easy,Poorly,Very well,Just right,,,Agree,Strongly Agree,Strongly Agree,Disagree,Disagree,Agree,1,1,m7xcm95f,,,,,0
26,qvoffcsq,BLU_16,0,45,45,survey,Completion,2024-05-16 11:41:36.552968,1,,,162.0,26,,0.0,if not A i would propose 34:33:33 split,most of them accepted a fair offer. Only one player A demanded 50 point for themselfes,Medium difficulty,Well,Very well,Too much,How people use power for their financial advantage. ,,Neutral,Agree,Agree,Agree,Agree,Disagree,1,1,m7xcm95f,,,,,0
27,lv2l10fd,BLU_34,0,45,45,survey,Completion,2024-05-16 11:41:36.562159,1,,,93.0,27,,0.0,try to give equal amount. But some A really wanted more,Some were okay with 0 points.  I thought if they had some other info,Easy,Very well,Very well,Just right,Would you share it or risk to negotiate,Good experiment,Disagree,Agree,No opinion,Strongly Agree,Strongly Agree,Strongly Agree,1,1,m7xcm95f,,,,,0
28,r786u409,BLU_07,0,45,45,survey,Completion,2024-05-16 11:41:36.569005,1,,,134.0,28,,0.0,"always split it, that everyone get an equal amount. Because its fair.",Sometimes player A got too much power and tried to convice one of the B players.,Difficult,Neutral,Well,Too much,people behaviour in groups,interesting experiment,Strongly Disagree,Agree,Strongly Agree,No opinion,No opinion,Strongly Disagree,1,1,m7xcm95f,,,,,0
29,tn7aqwzf,BLU_23,0,45,45,survey,Completion,2024-05-16 11:41:36.575705,1,,,102.0,29,,0.0,the strategy would be to give to two player the same amount and to the last player a smaller amount so that I could have for sure one player that accept this proposal. Then together we could put pressure on the third player so that he has to accept the proposal,"Player A most of the time wanted to have the largest amount which was ridiculous at some point, their argument was because I am player A, you need me so you better accept the proposal or not.",Very easy,Very well,Very well,Way too much,,,Disagree,Strongly Agree,Strongly Agree,Strongly Agree,No opinion,Neutral,1,1,m7xcm95f,,,,,0
30,iowjjdnx,BLU_24,0,45,45,survey,Completion,2024-05-16 11:41:36.591178,1,,,138.0,30,,0.0,As a B player I tried to get both B players the same amount and then negotiate with the player A,I was player A at later stage and people thought you are A for the whole time so they were dismissive of any proposals to your benefit. The B players strive for fairness. ,Easy,Very well,Very well,Just right,How people bargain in when they are different possitions,,Strongly Agree,Strongly Agree,Agree,No opinion,Strongly Agree,Strongly Agree,1,1,m7xcm95f,,,,,0
31,clb9mrb7,BLU_17,0,45,45,survey,Completion,2024-05-16 11:41:36.599060,1,,,168.0,31,,0.0,always pick 34 33 33. nobody will disagree and it's fair.,"the other will also pick 34 33 33, since there's no necessary to be greedy. If player A broke the balance, the other two players would resist player a",Very easy,Very well,Very well,Way too much,would everybody goes to the eqiullibria finally,,Agree,Agree,Strongly Agree,Strongly Agree,Disagree,Strongly Agree,1,1,m7xcm95f,,,,,0
32,5kr8656h,BLU_11,0,45,45,survey,Completion,2024-05-16 11:41:36.607937,1,,,167.0,32,,0.0,"34 for A, 33 for Bs. As this is the only way leading to a win win. If A wants more, one of the Bs would possibly disagree with that deal and everybody gets nothing. And if A wants to go with only one B, all three palyers get less. Last but not least, no greed needed here.",Fantastic. Exactly the same as mine.,Very easy,Very well,Very well,Too much,about bargain strategy? actually no idea,i really enjoyed this,Disagree,Strongly Agree,Strongly Agree,Strongly Disagree,Strongly Disagree,Strongly Agree,1,1,m7xcm95f,,,,,0
33,ltuj7l8u,BLU_09,0,45,45,survey,Completion,2024-05-16 11:41:37.516023,1,,,168.0,33,,0.0,Generally I proposed as equal payment as possible. And always player A would take slightly higher. This way you are fair. The privilege of A is not fair but with this strategy you get them to cooperate. ,I think it was similar to mine. Not sure about the fair incentive. But certainly everybody supported a win-win situation. ,Easy,Very well,Very well,Just right,Bargaining power,,Strongly Disagree,Agree,Agree,Agree,Agree,Agree,1,1,m7xcm95f,,,,,0
34,wmh3d1u0,BLU_20,0,45,45,survey,Completion,2024-05-16 11:41:37.526918,1,,,166.0,34,,0.0,everyone equal and get the max,They all think the same,Easy,Well,Well,Too much,,,Neutral,Agree,Agree,Neutral,Neutral,Agree,1,1,m7xcm95f,,,,,0
35,rcu7iixo,BLU_05,0,45,45,survey,Completion,2024-05-16 11:41:37.537229,1,,,165.0,35,,0.0,Almost 3 people were included in every round and set the average value of each budget.,"They almost agreed with my opinions that we should choose the average budget values, I think we have held a lot of win-win situations.",Medium difficulty,Well,Well,Too much,Perfect,No,Neutral,Agree,Strongly Agree,Agree,Strongly Agree,Agree,1,1,m7xcm95f,,,,,0
36,5zlvsjpa,BLU_00,0,45,45,survey,Completion,2024-05-16 11:41:37.549366,1,,,166.0,36,,0.0,"34-33-33 because it's the most fair outcome, A always gets 34 because they are theoretically the most powerful player and thus get the extra point",the same. it was very satisfying to see everyone cooperating so nicely,Easy,Very well,Very well,Too much,How quickly will people converge on a fair outcome,"Great UI compared to every other study I've participated in so far, also have fun with data analysis since every group (even trial) had the same outcome in my case :)",Neutral,Strongly Agree,Strongly Agree,Strongly Agree,Strongly Agree,Strongly Agree,1,1,m7xcm95f,,,,,0
